===========================================================
-- UC1 Creating database as AddessBookService
===========================================================

mysql> create database AddressBookService1;
Query OK, 1 row affected (0.01 sec)

mysql> show databases;
+---------------------+
| Database            |
+---------------------+
| addressbookservice  |
| addressbookservice1 |
| addressbookservices |
| information_schema  |
| mysql               |
| performance_schema  |
| sakila              |
| sys                 |
| world               |
+---------------------+
9 rows in set (0.01 sec)


===========================================================
-- UC2  creating table as AddressBook with attributes
===========================================================

mysql> use AddressBookService1;
Database changed
mysql> create table AddressBook (
    -> firstName varchar(50) not null,
    -> lastName varchar(50) not null,
    -> address varchar(100) not null,
    -> city varchar(50) not null,
    -> state varchar(50) not null,
    -> zip int not null,
    -> phoneNumber double not null,
    ->  email varchar(100) not null );
Query OK, 0 rows affected (0.08 sec)

mysql> desc AddressBook;
+-------------+--------------+------+-----+---------+-------+
| Field       | Type         | Null | Key | Default | Extra |
+-------------+--------------+------+-----+---------+-------+
| firstName   | varchar(50)  | NO   |     | NULL    |       |
| lastName    | varchar(50)  | NO   |     | NULL    |       |
| address     | varchar(100) | NO   |     | NULL    |       |
| city        | varchar(50)  | NO   |     | NULL    |       |
| state       | varchar(50)  | NO   |     | NULL    |       |
| zip         | int          | NO   |     | NULL    |       |
| phoneNumber | double       | NO   |     | NULL    |       |
| email       | varchar(100) | NO   |     | NULL    |       |
+-------------+--------------+------+-----+---------+-------+
8 rows in set (0.02 sec)

===================================================
-- UC3 inserting new Contacts to AddressBook table
===================================================

mysql> insert into AddressBook (firstname, lastname, address,city, state, zip,phoneNumber,email) values
    -> ('Atul', 'mahajan','kothrud','pune','Maharashtra', 425401, 7083999198,'atulmahajan@gmail.com'),
    -> ('Shivam ','patil','Bharuch','surat','Gujrat', 561210, 999999999,'shivam@gmail.com');
Query OK, 2 rows affected (0.01 sec)
Records: 2  Duplicates: 0  Warnings: 0

mysql> desc AddressBook;
+-------------+--------------+------+-----+---------+-------+
| Field       | Type         | Null | Key | Default | Extra |
+-------------+--------------+------+-----+---------+-------+
| firstName   | varchar(50)  | NO   |     | NULL    |       |
| lastName    | varchar(50)  | NO   |     | NULL    |       |
| address     | varchar(100) | NO   |     | NULL    |       |
| city        | varchar(50)  | NO   |     | NULL    |       |
| state       | varchar(50)  | NO   |     | NULL    |       |
| zip         | int          | NO   |     | NULL    |       |
| phoneNumber | double       | NO   |     | NULL    |       |
| email       | varchar(100) | NO   |     | NULL    |       |
+-------------+--------------+------+-----+---------+-------+
8 rows in set (0.01 sec)


===========================================================
--> UC4 editing the existing contact by their firstname
===========================================================

mysql>   update AddressBook set  lastName='mahajan' where firstname='Atul';
Query OK, 0 rows affected (0.01 sec)
Rows matched: 2  Changed: 0  Warnings: 0

mysql>  update addressbook set phoneNumber=7058625849 where firstname='Shivam';
Query OK, 0 rows affected (0.00 sec)
Rows matched: 0  Changed: 0  Warnings: 0

mysql> select * from AddressBook;
+-----------+----------+---------+-------+-------------+--------+-------------+-----------------------+
| firstName | lastName | address | city  | state       | zip    | phoneNumber | email                 |
+-----------+----------+---------+-------+-------------+--------+-------------+-----------------------+
| Atul      | mahajan  | kothrud | pune  | Maharashtra | 425401 |  7083999198 | atulmahajan@gmail.com |
| Atul      | mahajan  | kothrud | pune  | Maharashtra | 425401 |  7083999198 | atulmahajan@gmail.com |
| Shivam    | patil    | Bharuch | surat | Gujrat      | 561210 |  7058625849 | shivam@gmail.com      |
+-----------+----------+---------+-------+-------------+--------+-------------+-----------------------+
3 rows in set (0.00 sec)

===========================================================
-- UC5 -deleting the contact by their lastname
===========================================================


mysql> delete from addressBook where lastname='mahajan';
Query OK, 2 rows affected (0.01 sec)

mysql> select * from AddressBook;
+-----------+----------+---------+-------+--------+--------+-------------+------------------+
| firstName | lastName | address | city  | state  | zip    | phoneNumber | email            |
+-----------+----------+---------+-------+--------+--------+-------------+------------------+
| Shivam    | patil    | Bharuch | surat | Gujrat | 561210 |   999999999 | shivam@gmail.com |
+-----------+----------+---------+-------+--------+--------+-------------+------------------+
1 row in set (0.00 sec)


===========================================================
--> UC6 retrieving the contact by city or state
===========================================================

mysql> select * from AddressBook where city = 'surat' or State='Gujrat';
+-----------+----------+---------+-------+--------+--------+-------------+------------------+
| firstName | lastName | address | city  | state  | zip    | phoneNumber | email            |
+-----------+----------+---------+-------+--------+--------+-------------+------------------+
| Shivam    | patil    | Bharuch | surat | Gujrat | 561210 |   999999999 | shivam@gmail.com |
+-----------+----------+---------+-------+--------+--------+-------------+------------------+
1 row in set (0.00 sec)

